{
  "$schema": "./capitulos.schema.json",
  "version": 2,
  "titulo_trabajo": "El zurdo",
  "extension": {
    "unidad": "lineas",
    "lineas_totales_objetivo": 12,
    "tolerancia_capitulo_lineas": 0,
    "tolerancia_total_lineas": 0
  },
  "defaults": {
    "pov": "prota",
    "lineas_objetivo": 4
  },
  "capitulos": [
    { "n": 1, "acto": 1, "titulo": "Guardia invertida", "lineas_objetivo": 4, "contiene_combate": false },
    { "n": 2, "acto": 2, "titulo": "Otro zurdo", "lineas_objetivo": 4, "contiene_combate": true },
    { "n": 3, "acto": 3, "titulo": "Después", "lineas_objetivo": 4, "contiene_combate": false }
  ]
}
