{
  "$schema": "./capitulos.schema.json",
  "version": 5,
  "titulo_trabajo": "El zurdo",
  "extension": {
    "unidad": "lineas",
    "lineas_totales_objetivo": 36,
    "tolerancia_capitulo_lineas": 0,
    "tolerancia_total_lineas": 0
  },
  "defaults": {
    "pov": "prota",
    "lineas_objetivo": 12,
    "parrafos_objetivo": 3,
    "lineas_por_parrafo": 4
  },
  "capitulos": [
    {
      "n": 1,
      "acto": 1,
      "titulo": "Guardia invertida",
      "lineas_objetivo": 12,
      "parrafos_objetivo": 3,
      "lineas_por_parrafo": 4,
      "contiene_combate": false
    },
    {
      "n": 2,
      "acto": 1,
      "lineas_objetivo": 12,
      "parrafos_objetivo": 3,
      "lineas_por_parrafo": 4,
      "contiene_combate": false
    },
    {
      "n": 3,
      "acto": 1,
      "lineas_objetivo": 12,
      "parrafos_objetivo": 3,
      "lineas_por_parrafo": 4,
      "contiene_combate": false
    }
  ]
}
